{"schema_version":"0.4.0","profile":"layered-depth-2d","completeness_policy":"layered-depth-2d-complete-v1","bounds":{"x":0,"y":0,"width":1280,"height":720},"spawn":{"x":96,"y":470},"nodes":[{"id":"spawn-node","x":96,"y":470,"kind":"spawn"},{"id":"far-node","x":330,"y":350,"kind":"route"},{"id":"npc-node","x":430,"y":560,"kind":"route"},{"id":"checkpoint-node","x":680,"y":420,"kind":"checkpoint"},{"id":"near-node","x":920,"y":600,"kind":"route"},{"id":"exit-node","x":1184,"y":470,"kind":"exit"}],"edges":[{"from":"spawn-node","to":"far-node","kind":"walk"},{"from":"spawn-node","to":"npc-node","kind":"walk"},{"from":"far-node","to":"checkpoint-node","kind":"walk"},{"from":"npc-node","to":"checkpoint-node","kind":"walk"},{"from":"checkpoint-node","to":"near-node","kind":"walk"},{"from":"near-node","to":"exit-node","kind":"walk"}],"exit_node_id":"exit-node"}
